Author,Title,Year,Link,Affiliation,Abstract,Author Keywords,Index Keywords
Ludhmila Abrahão Hajjar,A liberal strategy of red blood cell transfusion reduces cardiogenic shock in elderly patients undergoing cardiac surgery,2015,https://www.scopus.com/inward/record.uri?eid=2-s2.0-84948715860&doi=10.1016%2fj.jtcvs.2015.07.051&partnerID=40&md5=12b8209c3d79edc30788c04bab8cadb6,Universidade de São Paulo - Faculdade de Medicina,"Objective The aim of this study was to compare outcomes in patients undergoing cardiac surgery who are aged 60 years or more or less than 60 years after implementation of a restrictive or a liberal transfusion strategy. Methods This is a substudy of the Transfusion Requirements After Cardiac Surgery (TRACS) randomized controlled trial. In this subgroup analysis, we separated patients into those aged 60 years or more (elderly) and those aged less than 60 years randomized to a restrictive or a liberal strategy of red blood cell transfusion. The primary outcome was a composite defined as a combination of 30-day all-cause mortality and severe morbidity. Results Of the 502 patients included in the Transfusion Requirements After Cardiac Surgery study, 260 (51.8%) were aged 60 years or more and 242 (48.2%) were aged less than 60 years and were included in this study. The primary end point occurred in 11.9% of patients in the liberal strategy group and 16.8% of patients in the restrictive strategy group (P =.254) for those aged 60 years or more and in 6.8% of patients in the liberal strategy group and 5.6% of patients in the restrictive strategy group for those aged less than 60 years (P =.714). However, in the older patients, cardiogenic shock was more frequent in patients in the restrictive transfusion group (12.8% vs 5.2%, P =.031). Thirty-day mortality, acute respiratory distress syndrome, and acute renal injury were similar in the restrictive and liberal transfusion groups in both age groups. Conclusions Although there was no difference between groups regarding the primary outcome, a restrictive transfusion strategy may result in an increased rate of cardiogenic shock in elderly patients undergoing cardiac surgery compared with a more liberal strategy. Cardiovascular risk of anemia may be more harmful than the risk of blood transfusion in older patients. © 2015 The American Association for Thoracic Surgery.",cardiac surgery; cardiogenic shock; elderly; red blood cell transfusion,"adult; aged; anemia; Article; blood transfusion; cardiogenic shock; cardiovascular risk; controlled study; disease severity; erythrocyte transfusion; female; groups by age; heart surgery; human; kidney injury; major clinical study; male; morbidity; mortality; priority journal; randomized controlled trial; adverse effects; age; anemia; blood; Brazil; comparative study; erythrocyte transfusion; heart surgery; hematocrit; metabolism; middle aged; procedures; prospective study; risk factor; Shock, Cardiogenic; time; treatment outcome; biological marker; hemoglobin; Adult; Age Factors; Aged; Anemia; Biomarkers; Brazil; Cardiac Surgical Procedures; Erythrocyte Transfusion; Hematocrit; Hemoglobins; Humans; Middle Aged; Prospective Studies; Risk Factors; Shock, Cardiogenic; Time Factors; Treatment Outcome"
Ludhmila Abrahão Hajjar,Non-adrenergic vasopressors in patients with or at risk for vasodilatory shock. A systematic review and meta-analysis of randomized trials,2015,https://www.scopus.com/inward/record.uri?eid=2-s2.0-84955462353&doi=10.1371%2fjournal.pone.0142605&partnerID=40&md5=f95ac3935d7d2d5a6b97d6dbadad96c5,Universidade de São Paulo - Faculdade de Medicina,"Introduction: Hypotensive state is frequently observed in several critical conditions. If an adequate mean arterial pressure is not promptly restored, insufficient tissue perfusion and organ dysfunction may develop. Fluids and catecholamines are the cornerstone of critical hypotensive states management. Catecholamines side effects such as increased myocardial oxygen consumption and development of arrhythmias are well known. Thus, in recent years, interest in catecholamine-sparing agents such as vasopressin, terlipressin and methylene blue has increased; however, few randomized trials, mostly with small sample sizes, have been performed. We therefore conducted a meta-analysis of randomized trials to investigate the effect of non-catecholaminergic vasopressors on mortality. Methods: PubMed, BioMed Central and Embase were searched (update December 31st, 2014) by two independent investigators. Inclusion criteria were: random allocation to treatment, at least one group receiving a non-catecholaminergic vasopressor, patients with or at risk for vasodilatory shock. Exclusion criteria were: crossover studies, pediatric population, nonhuman studies, studies published as abstract only, lack of data on mortality. Studied drugs were vasopressin, terlipressin and methylene blue. Primary endpoint was mortality at the longest follow-up available. Results: A total of 1,608 patients from 20 studies were included in our analysis. The studied settings were sepsis (10/20 studies [50%]), cardiac surgery (7/20 [35%]), vasodilatory shock due to any cause (2/20 [19%]), and acute traumatic injury (1/20 [5%]). Overall, pooled estimates showed that treatment with non-catecholaminergic agents improves survival (278/810 [34.3%] versus 309/798 [38.7%], risk ratio = 0.88, 95%confidence interval = 0.79 to 0.98, p = 0.02). None of the drugs was associated with significant reduction inmortality when analyzed independently. Results were not confirmed when analyzing studies with a low risk of bias. Conclusions: Catecholamine-sparing agents in patients with or at risk for vasodilatory shock may improve survival. Further researches on this topic are needed to confirm the finding. © 2015 Belletti et al. This is an open access article distributed under the terms of the Creative Commons Attribution License, which permits unrestricted use, distribution, and reproduction in any medium, provided the original author and source are credited.",,"hypertensive factor; methylene blue; terlipressin; vasopressin; lypressin; methylene blue; vasoconstrictor agent; vasopressin derivative; acute disease; Article; drug use; follow up; heart surgery; human; injury; mortality; randomized controlled trial (topic); risk factor; sepsis; shock; survival rate; systematic review; vasodilatory shock; analogs and derivatives; factual database; meta analysis; sepsis; shock; Databases, Factual; Humans; Lypressin; Methylene Blue; Randomized Controlled Trials as Topic; Sepsis; Shock; Vasoconstrictor Agents; Vasopressins"
Ludhmila Abrahão Hajjar,In reply,2015,https://www.scopus.com/inward/record.uri?eid=2-s2.0-84942066403&partnerID=40&md5=d6bcc04a6e8b0c39c3c40b2e981011dd,Universidade de São Paulo - Faculdade de Medicina,[No abstract available],,hemoglobin; serum albumin; abdominal surgery; blood storage; blood transfusion; cancer patient; comorbidity; critically ill patient; death; erythrocyte transfusion; hazard ratio; heart surgery; hemoglobin determination; human; intensive care; Letter; mortality; postoperative complication; priority journal; septic shock; Sequential Organ Failure Assessment Score; surgical patient; Abdominal Neoplasms; female; male; procedures; statistics and numerical data; Abdominal Neoplasms; Erythrocyte Transfusion; Female; Humans; Male
Ludhmila Abrahão Hajjar,Liberal transfusion strategy improves survival in perioperative but not in critically ill patients. A meta-analysis of randomised trials,2015,https://www.scopus.com/inward/record.uri?eid=2-s2.0-84943260109&doi=10.1093%2fbja%2faev317&partnerID=40&md5=88f4b5b82081be00289525f9c9eeff98,Universidade de São Paulo - Faculdade de Medicina,"Background Guidelines support the use of a restrictive strategy in blood transfusion management in a variety of clinical settings. However, recent randomized controlled trials (RCTs) performed in the perioperative setting suggest a beneficial effect on survival of a liberal strategy. We aimed to assess the effect of liberal and restrictive blood transfusion strategies on mortality in perioperative and critically ill adult patients through a meta-analysis of RCTs. Methods We searched PubMed/Medline, Embase, Cochrane Central Register of Controlled Trials, Transfusion Evidence Library, and Google Scholar up to 27 March 2015, for RCTs performed in perioperative or critically ill adult patients, receiving a restrictive or liberal transfusion strategy, and reporting all-cause mortality. We used a fixed or random-effects model to calculate the odds ratio (OR) and 95% confidence interval (CI) for pooled data. We assessed heterogeneity using Cochrane's Q and I2 tests. The primary outcome was all-cause mortality within 90-day follow-up. Results Patients in the perioperative period receiving a liberal transfusion strategy had lower all-cause mortality when compared with patients allocated to receive a restrictive transfusion strategy (OR 0.81; 95% CI 0.66 1.00; P=0.05; I2=25%; Number needed to treat=97) with 7552 patients randomized in 17 trials. There was no difference in mortality among critically ill patients receiving a liberal transfusion strategy when compared with the restrictive transfusion strategy (OR 1.10; 95% CI 0.991.23; P=0.07; I2=34%) with 3469 patients randomized in 10 trials. Conclusion According to randomized published evidence, perioperative adult patients have an improved survival when receiving a liberal blood transfusion strategy. © 2015 The Author 2015.",anesthesia; blood transfusion; critical illness; mortality; perioperative care,hemoglobin; Article; blood transfusion; cause of death; critically ill patient; hematocrit; hemoglobin blood level; human; liberal blood transfusion; meta analysis; perioperative period; postoperative period; priority journal; prognosis; randomized controlled trial (topic); restrictive blood transfusion; surgical mortality; surgical patient; survival; systematic review; blood transfusion; critical illness; intensive care; mortality; perioperative period; procedures; randomized controlled trial (topic); statistics and numerical data; survival; treatment outcome; Blood Transfusion; Critical Care; Critical Illness; Humans; Perioperative Care; Randomized Controlled Trials as Topic; Survival Analysis; Treatment Outcome
Ludhmila Abrahão Hajjar,Insulin therapy in insulin resistance: Could it be part of a lethal pathway?,2015,https://www.scopus.com/inward/record.uri?eid=2-s2.0-84927758941&doi=10.1016%2fj.atherosclerosis.2015.04.013&partnerID=40&md5=fd7057365e1131648a81f74aaf9e936d,Universidade de São Paulo - Faculdade de Medicina,[No abstract available],Cardiovascular disease; Diabetes; Insulin resistance; Insulin therapy; Mortality,"hemoglobin A1c; insulin; oral antidiabetic agent; antidiabetic agent; insulin; blood glucose monitoring; cardiovascular disease; case control study; diabetes mellitus; disease duration; human; insulin resistance; insulin treatment; metabolic parameters; Note; priority journal; Cardiovascular Diseases; Diabetes Mellitus, Type 2; female; male; Cardiovascular Diseases; Diabetes Mellitus, Type 2; Female; Humans; Hypoglycemic Agents; Insulin; Male"
Ludhmila Abrahão Hajjar,Strategies to reduce blood transfusion: A Latin-American perspective,2015,https://www.scopus.com/inward/record.uri?eid=2-s2.0-84920735484&doi=10.1097%2fACO.0000000000000144&partnerID=40&md5=f4433158318b9b5e44e96e7551898460,Universidade de São Paulo - Faculdade de Medicina,"Purpose of Review: Anemia has been demonstrated to be detrimental in several populations such as high-surgical-risk patients, critically ill elderly, and cardiac patients. Red blood cell transfusion is the most commonly prescribed therapy for anemia. Despite being life-saving, it carries a risk that ranges from mild complications to death. The aim of this review is to discuss the risks of anemia and blood transfusion, and to describe recent developments in the strategies to reduce allogeneic blood transfusion. Recent Findings: In the past decades, clinical studies comparing transfusion strategies in different populations were conducted. Despite the challenges imposed by the development of such studies, evidence-based medicine on transfusion medicine in critically ill patients is being created. Different results arising from these studies reflect population heterogeneity, specific circumstances, and difficulties in measuring the impact of anemia and transfusion in a clinical trial. Summary: An adequate judgment of a clinical condition associated with proper application of the available literature is the cornerstone in the management of transfusion in critical care. Apart from this individualized strategy, the institution of a patient blood management program allows goal-directed approach through preoperative recognition of anemia, surgical efforts to minimize blood loss, and continuous assessment of the coagulation status. © 2015 Wolters Kluwer Health, Inc. All rights reserved.",anemia; blood transfusion; individualized approach; patient blood management,anemia; blood transfusion; clinical trial (topic); critically ill patient; evidence based medicine; human; Latin American medicine; population research; priority journal; Review; risk assessment; transfusion medicine
Ludhmila Abrahão Hajjar,"Transfusion requirements in surgical oncology patients: A prospective, randomized controlled trial",2015,https://www.scopus.com/inward/record.uri?eid=2-s2.0-84925356457&partnerID=40&md5=232798c2ca801e32c546dc65a0753d8b,Universidade de São Paulo - Faculdade de Medicina,"Background: Several studies have indicated that a restrictive erythrocyte transfusion strategy is as safe as a liberal one in critically ill patients, but there is no clear evidence to support the superiority of any perioperative transfusion strategy in patients with cancer. Methods: In a randomized, controlled, parallel-group, double-blind (patients and outcome assessors) superiority trial in the intensive care unit of a tertiary oncology hospital, the authors evaluated whether a restrictive strategy of erythrocyte transfusion (transfusion when hemoglobin concentration <7 g/dl) was superior to a liberal one (transfusion when hemoglobin concentration <9 g/dl) for reducing mortality and severe clinical complications among patients having major cancer surgery. All adult patients with cancer having major abdominal surgery who required postoperative intensive care were included and randomly allocated to treatment with the liberal or the restrictive erythrocyte transfusion strategy. The primary outcome was a composite endpoint of mortality and morbidity. Results: A total of 198 patients were included as follows: 101 in the restrictive group and 97 in the liberal group. The primary composite endpoint occurred in 19.6% (95% CI, 12.9 to 28.6%) of patients in the liberal-strategy group and in 35.6% (27.0 to 45.4%) of patients in the restrictive-strategy group (P = 0.012). Compared with the restrictive strategy, the liberal transfusion strategy was associated with an absolute risk reduction for the composite outcome of 16% (3.8 to 28.2%) and a number needed to treat of 6.2 (3.5 to 26.5). Conclusion: A liberal erythrocyte transfusion strategy with a hemoglobin trigger of 9 g/dl was associated with fewer major postoperative complications in patients having major cancer surgery compared with a restrictive strategy. Copyright © 2014, the American Society of Anesthesiologists, Inc.",,abdominal infection; abdominal surgery; acute kidney failure; adult; adult respiratory distress syndrome; Article; cancer surgery; controlled study; double blind procedure; erythrocyte transfusion; female; hemoglobin determination; human; intensive care; liberal erythrocyte transfusion; major clinical study; major surgery; male; morbidity; mortality; multiple organ failure; postoperative care; priority journal; prospective study; randomized controlled trial; reoperation; respiratory failure; restrictive erythrocyte transfusion; risk reduction; septic shock; Abdominal Neoplasms; Brazil; erythrocyte transfusion; follow up; intensive care unit; middle aged; outcome assessment; Postoperative Complications; procedures; risk; statistics and numerical data; hemoglobin; Abdominal Neoplasms; Brazil; Double-Blind Method; Erythrocyte Transfusion; Female; Follow-Up Studies; Hemoglobins; Humans; Intensive Care Units; Male; Middle Aged; Outcome Assessment (Health Care); Postoperative Complications; Prospective Studies; Risk
Ludhmila Abrahão Hajjar,Should we avoid invasive treatment in cancer patients with pericardial tamponade?,2014,https://www.scopus.com/inward/record.uri?eid=2-s2.0-84930079485&doi=10.1186%2fcc13280&partnerID=40&md5=b3ba88e39c57a208802a19481261be1a,Universidade de São Paulo - Faculdade de Medicina,[No abstract available],,
Ludhmila Abrahão Hajjar,"ε-Aminocaproic acid does not increase adverse effects in cardiac surgery: An analysis of 2,852 cases",2014,https://www.scopus.com/inward/record.uri?eid=2-s2.0-84930075007&doi=10.1186%2fcc13294&partnerID=40&md5=0a11b9f84589473c950705a84545d559,Universidade de São Paulo - Faculdade de Medicina,[No abstract available],,
Ludhmila Abrahão Hajjar,Transfusion requirements in septic shock patients: A randomized controlled trial,2014,https://www.scopus.com/inward/record.uri?eid=2-s2.0-84926370472&doi=10.1186%2fcc13302&partnerID=40&md5=a224140e176ce30c837c021641eebcce,Universidade de São Paulo - Faculdade de Medicina,[No abstract available],,
Ludhmila Abrahão Hajjar,A liberal strategy of red blood cell transfusion reduces cardiovascular complications in older patients undergoing cardiac surgery,2014,https://www.scopus.com/inward/record.uri?eid=2-s2.0-84926304064&doi=10.1186%2fcc13297&partnerID=40&md5=05bbdb6358f28d088ab3b97bf35e0ed9,Universidade de São Paulo - Faculdade de Medicina,[No abstract available],,
Ludhmila Abrahão Hajjar,Very old patients with cancer admitted to the ICU: Outcome and predictive factors of mortality,2014,https://www.scopus.com/inward/record.uri?eid=2-s2.0-84930074997&doi=10.1186%2fcc13248&partnerID=40&md5=e6d6008307bbdc8b2f8ca802f6a55ad9,Universidade de São Paulo - Faculdade de Medicina,[No abstract available],,
Ludhmila Abrahão Hajjar,Clinical recommendations for postoperative care after heart transplantation in children: 21 years of a single-center experience,2014,https://www.scopus.com/inward/record.uri?eid=2-s2.0-84893118264&doi=10.6061%2fclinics%2f2014%28Sup01%2909&partnerID=40&md5=504964855e07470cb3118e4f5df4a2f1,Universidade de São Paulo - Faculdade de Medicina,Heart transplantation is an option for children with complex congenital heart disease and cardiomyopathies. A patient's quality of life and long-term survival depend on successful management of the surgical complications and adverse side effects of immunosuppression. The purpose of this review was to summarize the practical management of postoperative care in this patient population and to make recommendations for the future. © 2014 CLINICS.,Children; Heart transplantation; Immunosuppression; Postoperative care; Rejection,"adverse effects; Cardiomyopathies; child; graft rejection; Heart Defects, Congenital; heart transplantation; human; postoperative care; procedures; quality of life; Cardiomyopathies; Child; Graft Rejection; Heart Defects, Congenital; Heart Transplantation; Humans; Postoperative Care; Quality of Life"
Ludhmila Abrahão Hajjar,Hemostatic effects of fibrinogen concentrate compared with cryoprecipitate in children after cardiac surgery: A randomized pilot trial,2014,https://www.scopus.com/inward/record.uri?eid=2-s2.0-84908233064&doi=10.1016%2fj.jtcvs.2014.04.029&partnerID=40&md5=a287899a5eb8855cd70cbdfa80539f58,Universidade de São Paulo - Faculdade de Medicina,"Results: A total of 63 patients were included in the study, 30 in the fibrinogen concentrate group and 33 in the cryoprecipitate group. The median 48-hour blood loss was not significantly different between the 2 groups (320 mL [interquartile range, 157-750] vs 410 mL [interquartile range, 215-510], respectively; P = .672). After treatment, plasma fibrinogen concentration increased similarly following administration of both products. There were no differences in allogeneic blood transfusion after intervention treatment.Conclusions: A large trial comparing fibrinogen concentrate and cryoprecipitate in the management of children with acute acquired hypofibrinogenemia during heart surgery is feasible. The preliminary results of our study showed that the use of fibrinogen concentrate was as efficient and safe as cryoprecipitate in the management of bleeding children undergoing cardiac surgery.Objectives: Acute acquired hypofibrinogenemia in children undergoing cardiac surgery is a major concern because it often results in perioperative bleeding and high rates of allogeneic blood transfusion. Fibrinogen concentrate has been proposed as an alternative to cryoprecipitate (the gold standard therapy), with minimal infectious and immunologic risks. Our objective was to investigate the efficacy and safety of fibrinogen concentrate in children undergoing cardiac surgery.Methods: In this randomized pilot study, patients were allocated to receive fibrinogen concentrate (60 mg/kg) or cryoprecipitate (10 mL/kg) if bleeding was associated with fibrinogen levels < 1 g/dL after cardiopulmonary bypass weaning. The primary outcome was postoperative blood losses during the 48 hours after surgery. © 2014 The American Association for Thoracic Surgery.",,"blood clotting factor 10; blood clotting factor 13; blood clotting factor 7; blood clotting factor 9; fibrinogen; fibrinogen concentrate; prothrombin; blood clotting factor 8; cryoprecipitate coagulum; fibrinogen; acute heart infarction; acute kidney failure; adult; anaphylaxis; artery thrombosis; Article; artificial ventilation; bleeding; blood clotting test; blood transfusion; cardiopulmonary bypass; cause of death; cerebrovascular accident; controlled study; cryoprecipitate; deep vein thrombosis; drug effect; drug eruption; drug fever; drug hypersensitivity; drug induced headache; drug safety; dyspnea; feasibility study; female; fibrinogen blood level; follow up; heart infarction; heart surgery; human; lung embolism; major clinical study; male; outcome assessment; patient safety; pediatric surgery; peripheral occlusive artery disease; pilot study; postoperative hemorrhage; postoperative period; prospective study; randomized controlled trial; reoperation; septic shock; thromboembolism; vomiting; Brazil; child; erythrocyte transfusion; infant; operative blood loss; preschool child; statistics and numerical data; treatment outcome; Blood Coagulation Tests; Blood Loss, Surgical; Brazil; Cardiac Surgical Procedures; Cardiopulmonary Bypass; Child; Child, Preschool; Erythrocyte Transfusion; Factor VIII; Female; Fibrinogen; Humans; Infant; Male; Pilot Projects; Prospective Studies; Treatment Outcome"
