Author,Title,Year,Link,Affiliation,Abstract,Author Keywords,Index Keywords
Ludhmila Abrahão Hajjar,Bronchial injury and pneumothorax after reintubation using an airway exchange catheter,2013,https://www.scopus.com/inward/record.uri?eid=2-s2.0-84927170344&doi=10.1016%2fj.bjane.2012.02.001&partnerID=40&md5=64856defa3fdca85bc356d3d3a0c756f,Universidade de São Paulo - Faculdade de Medicina,"BACKGROUND AND OBJECTIVES: We report a case of pneumothorax caused by a bronchial perforation during a reintubation using an airway exchange catheter (AEC) in a patient with a head and neck cancer.CASE REPORT: A 53 year old man with oropharynx carcinoma was admitted to ICU for severe pneumonia and severe acute respiratory distress syndrome (ARDS). The patient was recognized as a difficult-to-intubate patient and an endotracheal tube (ETT) was inserted through a bronchoscope. After one week of treatment, it was observed an endotracheal cuff perforation. Exchanging the endotracheal tube was necessary to achieve satisfactory pulmonary ventilation. An AEC Cook 14 was used to perform the reintubation. After reintubation, the patient presented a worsening in oxygen saturation and a chest radiography (CXR) revealed a large pneumothorax. A chest tube was inserted and we observed immediate improvement in oxygen saturation. A repeat CXR confirmed correct positioning of the chest tube and reexpansion of the right lung. A bronchoscopy performed showed a posterior laceration in the right main bronchus. The patient was extubated the following day. After four days, the chest tube was removed. A CXR performed a day after chest tube removal revealed a small right upper pneumothorax, but the patient remained asymptomatic.CONCLUSIONS: Airway exchange catheter is a valuable tool to handle with difficult-to-intubate patients. Although the physicians generally focus their attention in avoid barotrauma--caused by oxygen supplement or jet ventilation through AEC--concern for insertion technique can minimize life threatening complications and increase the safety of AEC. Copyright © 2013 Sociedade Brasileira de Anestesiologia. Published by Elsevier Editora Ltda. All rights reserved.",Airway Management; Anesthesia; Intensive Care; Intratracheal; Intubation,"adverse effects; bronchus; case report; catheter; complication; endotracheal intubation; human; injuries; male; middle aged; pneumothorax; procedures; respiration control; Respiratory Distress Syndrome, Adult; Airway Management; Bronchi; Catheters; Humans; Intubation, Intratracheal; Male; Middle Aged; Pneumothorax; Respiratory Distress Syndrome, Adult"
Ludhmila Abrahão Hajjar,Volume replacement therapy during hip arthroplasty using hydroxyethyl starch (130/0.4) compared to lactated Ringer decreases allogeneic blood transfusion and postoperative infection,2013,https://www.scopus.com/inward/record.uri?eid=2-s2.0-84927170588&doi=10.1016%2fj.bjane.2012.03.002&partnerID=40&md5=60390813be7bf55279768a0b9c39a7ba,Universidade de São Paulo - Faculdade de Medicina,"BACKGROUND AND OBJECTIVES: Hydroxyethyl starch (HES) 130/0.4 is considered an effective plasma expander when compared to crystalloids. There is controversy around its superiority regarding hemodynamic optimization and about possible detrimental effects on coagulation. The aim of this study was to compare the effects of HES 130/0.4 to lactated Ringer solution during hip arthroplasty in adult patients under spinal anesthesia regarding intraoperative bleeding, hemodynamic parameters, coagulation profile, transfusion requirements and clinical outcomes.METHODS: In this randomized, controlled trial, 48 patients scheduled for hip arthroplasty with spinal anesthesia were randomized into two groups: 24 patients were allocated to receive a preload of 15 mL.kg(-1) of HES 130/0.4 and 24 patients received a preload of 30 mL.kg(-1) lactated Ringer solution before surgery. Hemodynamic measurements, hemoglobin concentrations, biochemical parameters and coagulation tests were evaluated in three periods during surgical procedure. Patients received medical follow-up during their hospital stay and up to postoperative 30 days. Primary outcome was the requirement of red blood cell transfusion between groups during hospital stay. Secondary outcome were hemodynamic parameters, length of hospital stay, mortality and occurrence of clinical postoperative complications.RESULTS: Red blood cell transfusion was required in 17% of patients in the HES group and in 46% in the Ringer group (p = .029). Postoperative infections were more frequently observed in the Ringer group (17%) compared to the HES group (0), p = .037. There were no significant differences between groups in mortality, hospital length of stay and clinical complications other than infection.CONCLUSIONS: During hip arthroplasty, patients treated with hypervolemic hemodilution with hydroxyethyl starch 130/0.4 required less transfusion and presented lower infection rate compared to patients who received lactated Ringer. Copyright © 2013 Sociedade Brasileira de Anestesiologia. Published by Elsevier Editora Ltda. All rights reserved.",Anesthesia; Arthroplasty; Blood Transfusion; Hemodilution; Hetastarch; Hip; Replacement; Spinal,"hetastarch derivative; isotonic solution; plasma substitute; Ringer's lactate; blood transfusion; blood volume; comparative study; controlled study; cross infection; drug effects; female; hemodynamics; hip arthroplasty; human; male; middle aged; Postoperative Complications; procedures; randomized controlled trial; statistics and numerical data; Arthroplasty, Replacement, Hip; Blood Transfusion; Blood Volume; Cross Infection; Female; Hemodynamics; Humans; Hydroxyethyl Starch Derivatives; Isotonic Solutions; Male; Middle Aged; Plasma Substitutes; Postoperative Complications"
Ludhmila Abrahão Hajjar,Volume Replacement Therapy during Hip Arthroplasty using Hydroxyethyl Starch (130/0.4) Compared to Lactated Ringer Decreases Allogeneic Blood Transfusion and Postoperative Infection,2013,https://www.scopus.com/inward/record.uri?eid=2-s2.0-84874298692&doi=10.1016%2fS0034-7094%2813%2970196-X&partnerID=40&md5=869449222f6654c44cb423de8590455e,Universidade de São Paulo - Faculdade de Medicina,"Background and objectives: Hydroxyethyl starch (HES) 130/0.4 is considered an effective plasma expander when compared to crystalloids. There is controversy around its superiority regarding hemodynamic optimization and about possible detrimental effects on coagulation. The aim of this study was to compare the effects of HES 130/0.4 to . lactated Ringer solution during hip arthroplasty in adult patients under spinal anesthesia regarding intraoperative bleeding, hemodynamic parameters, coagulation profile, transfusion requirements and clinical outcomes. Methods: In this randomized, controlled trial, 48 patients scheduled for hip arthroplasty with spinal anesthesia were randomized into two groups: 24 patients were allocated to receive a preload of 15mL.kg-1 of HES 130/0.4 and 24 patients received a preload of 30mL.kg-1 lactated Ringer solution before surgery. Hemodynamic measurements, hemoglobin concentrations, biochemical parameters and coagulation tests were evaluated in three periods during surgical procedure. Patients received medical follow-up during their hospital stay and up to postoperative 30 days. Primary outcome was the requirement of red blood cell transfusion between groups during hospital stay. Secondary outcome were hemodynamic parameters, length of hospital stay, mortality and occurrence of clinical postoperative complications. Results: Red blood cell transfusion was required in 17% of patients in the HES group and in 46% in the Ringer group (p. =. .029). Postoperative infections were more frequently observed in the . Ringer group (17%) compared to the HES group (0), p. =. .037. There were no significant differences between groups in mortality, hospital length of stay and clinical complications other than infection. Conclusions: During hip arthroplasty, patients treated with hypervolemic hemodilution with hydroxyethyl starch 130/0.4 required less transfusion and presented lower infection rate compared to patients who received lactated Ringer. Justificativa e objetivos: O hidroxietilamido 130/0,4 (HES 130/0,4) é considerado um expansor plasmático efetivo quando comparado com cristaloides. Há controvérsia sobre sua superioridade em relação à otimização hemodinâmica e sobre possíveis efeitos prejudiciais na coagulação. O objetivo deste estudo foi comparar os efeitos do HES 130/0,4 com os da solução de Ringer lactato durante artroplastia de quadril em pacientes adultos sob raquianestesia e levou em consideração sangramento intraoperatório, parâmetros hemodinâmicos, coagulograma, necessidade de transfusão e desfechos clínicos. Métodos: Neste estudo randômico e controlado, 48 pacientes agendados para artroplastia de quadril com raquianestesia foram alocados em dois grupos: 24 receberam uma pré-carga de HES 130/0,4 (15mL.kg-1) e 24 receberam uma pré-carga de solução de Ringer lactato (30mL. kg-1) antes da cirurgia. Mensurações hemodinâmicas, concentração de hemoglobina, parâmetros bioquímicos e testes de coagulação foram avaliados em três períodos durante o procedimento cirúrgico. Os pacientes receberam acompanhamento médico durante a internação e até 30 dias no período pós-operatório. O principal fator foi a necessidade de transfusão de hemácias entre os grupos durante a internação. Os fatores secundários foram parâmetros hemodinâmicos, tempo de internação, mortalidade e ocorrência de complicações clínicas. no período pós-operatório. O principal fator foi a necessidade de transfusão de hemácias entre os grupos durante a internação. Os fatores secundários foram parâmetros hemodinâmicos, tempo de internação, mortalidade e ocorrência de complicações clínicas. Resultados: A transfusão de hemácias foi necessária em 17% dos pacientes do grupo HES e em 46% dos pacientes do grupo Ringer lactato (p. =. 0,029). Infecções pós-operatórias foram observadas com mais frequência no grupo de Ringer lactato (17%) em comparação com o grupo HES (0), p. =. 0,037. Não houve diferenças significativas entre os grupos em relação à mortalidade, ao tempo de internação e às complicações clínicas, exceto infecção. Conclusões: Durante a artroplastia de quadril, os pacientes tratados com hemodiluição hipervolêmica normal com hidroxietilamido 130/0,4 precisaram de menos transfusão e apresentaram índice menor de infecção em comparação com os pacientes que receberam Ringer lactato. © 2013 Elsevier Editora Ltda..",Anesthesia; Arthroplasty; Blood Transfusion; Hemodilution; Hetastarch; Hip; Replacement; Spinal,"bupivacaine; hemoglobin; hetastarch; propofol; Ringer lactate solution; adult; article; biochemistry; bleeding; blood clotting; clinical article; controlled study; erythrocyte transfusion; female; follow up; hemodynamic parameters; hip arthroplasty; hospitalization; human; intermethod comparison; intraoperative period; male; mortality; outcome assessment; perioperative period; postoperative complication; postoperative infection; postoperative period; randomized controlled trial; spinal anesthesia; substitution therapy; thrombocyte aggregation; Arthroplasty, Replacement, Hip; Blood Transfusion; Double-Blind Method; Female; Hemodynamics; Humans; Hydroxyethyl Starch Derivatives; Intraoperative Care; Isotonic Solutions; Male; Middle Aged; Plasma Substitutes; Prospective Studies; Prosthesis-Related Infections"
Ludhmila Abrahão Hajjar,High levels of B-type natriuretic peptide predict weaning failure from mechanical ventilation in adult patients after cardiac surgery,2013,https://www.scopus.com/inward/record.uri?eid=2-s2.0-84874170736&doi=10.6061%2fclinics%2f2013%2801%29OA05&partnerID=40&md5=81a2070985239007c8c6d47c6599c313,Universidade de São Paulo - Faculdade de Medicina,"Objective: The failure to wean from mechanical ventilation is related to worse outcomes after cardiac surgery. The aim of this study was to evaluate whether the serum level of B-type natriuretic peptide is a predictor of weaning failure from mechanical ventilation after cardiac surgery. Methods: We conducted a prospective, observational cohort study of 101 patients who underwent on-pump coronary artery bypass grafting. B-type natriuretic peptide was measured postoperatively after intensive care unit admission and at the end of a 60-min spontaneous breathing test. The demographic data, hemodynamic and respiratory parameters, fluid balance, need for vasopressor or inotropic support, and length of the intensive care unit and hospital stays were recorded. Weaning failure was considered as either the inability to sustain spontaneous breathing after 60 min or the need for reintubation within 48 h. Results: Of the 101 patients studied, 12 patients failed the weaning trial. There were no differences between the groups in the baseline or intraoperative characteristics, including left ventricular function, EuroSCORE and lengths of the cardiac procedure and cardiopulmonary bypass. The B-type natriuretic peptide levels were significantly higher at intensive care unit admission and at the end of the breathing test in the patients with weaning failure compared with the patients who were successfully weaned. In a multivariate model, a high Btype natriuretic peptide level at the end of a spontaneous breathing trial was the only independent predictor of weaning failure from mechanical ventilation. Conclusions: A high B-type natriuretic peptide level is a predictive factor for the failure to wean from mechanical ventilation after cardiac surgery. These findings suggest that optimizing ventricular function should be a goal during the perioperative period. © 2013 CLINICS.",B-type natriuretic peptide; Cardiac surgery; Mechanical ventilation; Weaning failure,"biological marker; brain natriuretic peptide; adult; age; aged; article; artificial ventilation; blood; epidemiology; female; heart surgery; heart ventricle function; hemodynamics; human; lung function test; male; middle aged; pathophysiology; postoperative period; predictive value; risk assessment; sex difference; time; treatment failure; Adult; Age Factors; Aged; Biological Markers; Cardiac Surgical Procedures; Epidemiologic Methods; Female; Hemodynamics; Humans; Male; Middle Aged; Natriuretic Peptide, Brain; Postoperative Period; Predictive Value of Tests; Respiratory Function Tests; Risk Assessment; Sex Factors; Time Factors; Treatment Failure; Ventilator Weaning; Ventricular Dysfunction"
Ludhmila Abrahão Hajjar,Respiratory failure after lung transplantation: Extracorporeal membrane oxygenation as a rescue treatment,2012,https://www.scopus.com/inward/record.uri?eid=2-s2.0-84872354033&doi=10.6061%2fclinics%2f2012%2812%2932&partnerID=40&md5=328159500e5b91d4c7e408d9042c37a8,Universidade de São Paulo - Faculdade de Medicina,[No abstract available],,adult; article; case report; extracorporeal oxygenation; female; human; lung transplantation; methodology; respiratory failure; salvage therapy; Extracorporeal Membrane Oxygenation; Female; Humans; Lung Transplantation; Respiratory Insufficiency; Salvage Therapy; Young Adult
Ludhmila Abrahão Hajjar,Diaphragmatic pacing stimulation in spinal cord injury: Anesthetic and perioperative management,2012,https://www.scopus.com/inward/record.uri?eid=2-s2.0-84870398786&doi=10.6061%2fclinics%2f2012%2811%2907&partnerID=40&md5=87e12c0c842974258c5dddadcfdf800b,Universidade de São Paulo - Faculdade de Medicina,"OBJECTIVE: The standard therapy for patients with high-level spinal cord injury is long-term mechanical ventilation through a tracheostomy. However, in some cases, this approach results in death or disability. The aim of this study is to highlight the anesthetics and perioperative aspects of patients undergoing insertion of a diaphragmatic pacemaker. METHODS: Five patients with quadriplegia following high cervical traumatic spinal cord injury and ventilatordependent chronic respiratory failure were implanted with a laparoscopic diaphragmatic pacemaker after preoperative assessments of their phrenic nerve function and diaphragm contractility through transcutaneous nerve stimulation. ClinicalTrials.gov: NCT01385384. RESULTS: The diaphragmatic pacemaker placement was successful in all of the patients. Two patients presented with capnothorax during the perioperative period, which resolved without consequences. After six months, three patients achieved continuous use of the diaphragm pacing system, and one patient could be removed from mechanical ventilation for more than 4 hours per day. CONCLUSIONS: The implantation of a diaphragmatic phrenic system is a new and safe technique with potential to improve the quality of life of patients who are dependent on mechanical ventilation because of spinal cord injuries. Appropriate indication and adequate perioperative care are fundamental to achieving better results. © 2012 CLINICS.",Anesthetic; Artificial diaphragm; Pacemaker; Perioperative management; Quadriplegia; Spinal cord injury,"adolescent; adult; anesthesia; article; artificial heart pacemaker; artificial ventilation; controlled clinical trial; controlled study; diaphragm; electrostimulation therapy; female; human; implantation; laparoscopy; male; methodology; perioperative period; quadriplegia; spinal cord injury; time; treatment outcome; Adolescent; Adult; Anesthesia; Diaphragm; Electric Stimulation Therapy; Female; Humans; Laparoscopy; Male; Pacemaker, Artificial; Perioperative Care; Perioperative Period; Prosthesis Implantation; Quadriplegia; Respiration, Artificial; Spinal Cord Injuries; Time Factors; Treatment Outcome; Young Adult"
Ludhmila Abrahão Hajjar,The impact of tacrolimus as rescue therapy in children using a double immunosuppressive regimen after heart transplantation.,2012,https://www.scopus.com/inward/record.uri?eid=2-s2.0-84874811515&partnerID=40&md5=a0642e8b34b032f103918edfa28cdb6e,Universidade de São Paulo - Faculdade de Medicina,"Organ transplant recipients with refractory rejection or intolerance to the prescribed immunosuppressant may respond to rescue therapy with tacrolimus. We sought to evaluate the clinical outcomes of children undergoing heart transplantation who required conversion from a cyclosporine-based, steroid-free therapy to a tacrolimus-based regimen. We performed a prospective, observational, cohort study of 28 children who underwent conversion from cyclosporine-based, steroid-free therapy to a tacrolimus-based therapy for refractory or late rejection or intolerance to cyclosporine. There was complete resolution of refractory rejection episodes and adverse side effects in all patients. The incidence rate (×100) of rejection episodes before and after conversion was 7.98 and 2.11, respectively (P ≤ .0001). There was a 25% mortality rate in patients using tacrolimus after a mean period of 60 months after conversion. Tacrolimus is effective as rescue therapy for refractory rejection and is a therapeutic option for pediatric patients. Copyright © 2012 Elsevier Inc. All rights reserved.",,"cyclosporin; immunosuppressive agent; tacrolimus; age; article; child; drug combination; drug substitution; graft rejection; heart transplantation; human; immunology; incidence; Kaplan Meier method; mortality; preschool child; prospective study; salvage therapy; time; treatment outcome; Age Factors; Child; Child, Preschool; Cyclosporine; Drug Substitution; Drug Therapy, Combination; Graft Rejection; Heart Transplantation; Humans; Immunosuppressive Agents; Incidence; Kaplan-Meier Estimate; Prospective Studies; Salvage Therapy; Tacrolimus; Time Factors; Treatment Outcome"
Ludhmila Abrahão Hajjar,Positive fluid balance is associated with reduced survival in critically ill patients with cancer,2012,https://www.scopus.com/inward/record.uri?eid=2-s2.0-84862159074&doi=10.1111%2fj.1399-6576.2012.02717.x&partnerID=40&md5=fdd57651debe2c46d51256e2208f5821,Universidade de São Paulo - Faculdade de Medicina,"Background There are no studies that describe the impact of the cumulative fluid balance on the outcomes of cancer patients admitted to intensive care units ICUs. The aim of our study was to evaluate the relationship between fluid balance and clinical outcomes in these patients. Method One hundred twenty-two cancer patients were prospectively evaluated for survival during a 30-day period. Univariate (Chi-square, t-test, Mann-Whitney) and multiple logistic regression analyses were used to identify the admission parameters associated with mortality. Results The mean cumulative fluid balance was significantly higher in non-survivors than in survivors [1675 ml/24 h (471-2921) vs. 887 ml/24 h (104-557), P = 0.017]. We used the area under the curve and the intersection of the sensibility and specificity curves to define a cumulative fluid balance value of 1100 ml/24 h. This value was used in the univariate model. In the multivariate model, the following variables were significantly associated with mortality in cancer patients: the Acute Physiology and Chronic Health Evaluation II score at admission [Odds ratio (OR) 1.15; 95% confidence interval (CI) (1.05-1.26), P = 0.003], the Lung Injury Score at admission [OR 2.23; 95% CI (1.29-3.87), P = 0.004] and a positive fluid balance higher than 1100 ml/24 h at ICU [OR 5.14; 95% CI (1.45-18.24), P = 0.011]. Conclusion A cumulative positive fluid balance higher than 1100 ml/24 h was independently associated with mortality in patients with cancer. These findings highlight the importance of improving the evaluation of these patients' volemic state and indicate that defined goals should be used to guide fluid therapy. © 2012 The Acta Anaesthesiologica Scandinavica Foundation.",,"adult; article; cancer patient; cancer survivor; chi square test; controlled study; critically ill patient; female; fluid balance; hospital admission; human; major clinical study; male; mortality; outcome assessment; positive fluid balance; priority journal; prospective study; rank sum test; Student t test; survival; Acute Kidney Injury; Aged; APACHE; Area Under Curve; Critical Illness; Female; Humans; Intubation, Intratracheal; Length of Stay; Logistic Models; Male; Middle Aged; Multiple Organ Failure; Neoplasms; Predictive Value of Tests; Respiration, Artificial; Shock, Septic; Survival; Treatment Outcome; Vasoconstrictor Agents; Water-Electrolyte Balance"
Ludhmila Abrahão Hajjar,Lactate and base deficit are predictors of mortality incritically ill patients with cancer,2011,https://www.scopus.com/inward/record.uri?eid=2-s2.0-84455163502&doi=10.1590%2fS1807-59322011001200007&partnerID=40&md5=057fe84bc68e607dd605f9137087a289,Universidade de São Paulo - Faculdade de Medicina,"OBJECTIVE: Cancer patients frequently require admission to intensive care unit. However, there are a few data regarding predictive factors for mortality in this group of patients. The aim of this study was to evaluate whether arterial lactate or standard base deficit on admission and after 24 hours can predict mortality for patients with cancer. METHODS: We evaluated 1,129 patients with severe sepsis, septic shock, or postoperative after high-risk surgery. Lactate and standard base deficit collected at admission and after 24 hours were compared between survivors and non-survivors. We evaluated whether these perfusion markers are independent predictors of mortality. RESULTS: There were 854 hospital survivors (76.5%). 24 h lactate >1.9 mmol/L and standard base deficit < -2.3 were independent predictors of intensive care unit mortality. 24 h lactate >1.9 mmol/L and 24 h standard base deficit < -2.3 mmol/Lwere independent predictors of hospital death. CONCLUSION: Our findings suggest that lactate and standard base deficit measurement should be included in the routine assessment of patients with cancer admitted to the intensive care unit with sepsis, septic shock or after highrisk surgery. These markers may be useful in the adequate allocation of resources in this population. © 2011 CLINICS.",Cancer; Critical care; Lactate; Mortality,lactic acid; article; blood; critical illness; disorders of acid base balance; female; human; male; middle aged; mortality; neoplasm; predictive value; survival; Acid-Base Imbalance; Critical Illness; Female; Hospital Mortality; Humans; Lactic Acid; Male; Middle Aged; Neoplasms; Predictive Value of Tests; Survival Analysis
Ludhmila Abrahão Hajjar,From the authors,2011,https://www.scopus.com/inward/record.uri?eid=2-s2.0-81055137272&partnerID=40&md5=882410bea9089316641b8d69374043f5,Universidade de São Paulo - Faculdade de Medicina,[No abstract available],,oseltamivir; acute lung injury; bronchiolitis; influenza A (H1N1); letter; lung hemorrhage; pandemic influenza; priority journal; respiratory distress
Ludhmila Abrahão Hajjar,Dobutamine administration in patients after cardiac surgery: Beneficial or harmful?,2011,https://www.scopus.com/inward/record.uri?eid=2-s2.0-80053247494&doi=10.1186%2fcc10439&partnerID=40&md5=7e55b7cea613e36910cbaf072a4c595c,Universidade de São Paulo - Faculdade de Medicina,[No abstract available],,dobutamine; levosimendan; milrinone; cardiotonic agent; cardiopulmonary bypass; cardiovascular risk; critically ill patient; drug safety; drug tolerance; heart ejection fraction; heart output; heart surgery; hemodynamics; human; kidney dysfunction; letter; mortality; postoperative complication; postoperative period; priority journal; treatment outcome; vasodilatation; chemically induced disorder; coronary artery bypass graft; heart valve; kidney failure; mortality; note; Cardiotonic Agents; Coronary Artery Bypass; Heart Valves; Hospital Mortality; Humans; Renal Insufficiency
